{
  "$schema": "./release-part.schema.json",
  "apiVersion": "underware.release-part/v1alpha1",
  "catalog": {
    "id": "s-channel",
    "kind": "channel",
    "name": "S offset channel",
    "icon": "∿",
    "category": "Cable routing",
    "description": "A resizable planning template for a generated S offset.",
    "widthCells": 5,
    "heightCells": 3
  },
  "provenance": {
    "sourceUrl": "https://makerworld.com/en/models/783010-underware-2-0-infinite-cable-management",
    "license": "CC-BY-NC-SA-4.0; verify the selected generator profile"
  },
  "physical": {
    "units": "mm",
    "sizing": "grid-derived",
    "printReadiness": "generator-required"
  },
  "capabilities": {
    "renderer": "channel/s/v1",
    "inspectors": ["channel-capacity/v1"]
  },
  "defaults": { "cables": 0 },
  "availability": { "systems": ["openGrid", "underware"] },
  "placement": {
    "grid": "active-system",
    "layer": "front",
    "resizing": "free"
  },
  "appearance": { "shadow": true },
  "print": { "strategy": "linear", "capacity": "cable" }
}
